{
  "meta:license": [
    "Copyright (c) 2020, Triad National Security, LLC.",
    "This code is provided under a BSD license as part of the Multi-Infrastructure Control",
    "and Optimization Toolkit (MICOT) project, LA-CC-13-108.",
    "You may not use this file except in compliance with the License. You may obtain a copy",
    "of the License at https://github.com/lanl-ansi/PowerModelsONM.jl/blob/main/LICENSE.md"
  ],
  "$schema": "http://json-schema.org/draft-07/schema#",
  "$id": "schemas/settings",
  "type": "object",
  "title": "Settings",
  "additionalProperties": false,
  "description": "Network settings to apply to the base network (_i.e._, all multinetwork timesteps, not a specific one), such as bus voltage bounds, load priorities, cold load pickup, and global settings such as maximum switch actions per timestep and time elapsed per time step.\n\n Additional properties on each object are allowed, but the object types are restricted to those in the ONM model.",
  "x-tags": ["input"],
  "examples": [
    {
      "max_switch_actions": [1, 1, 1],
      "time_elapsed": [0.1667, 0.1667, 0.1667],
      "load": {
        "671": {
          "clpu_factor": 2
        }
      }
    }
  ],
  "properties": {
    "settings": {
      "$ref": "./settings/input-settings-settings.schema.json"
    },
    "generator": {
      "$ref": "./settings/input-settings-generator.schema.json"
    },
    "solar": {
      "$ref": "./settings/input-settings-solar.schema.json"
    },
    "voltage_source": {
      "$ref": "./output-optimization_metadata.schema.json"
    },
    "storage": {
      "$ref": "./settings/input-settings-storage.schema.json"
    },
    "bus": {
      "$ref": "./settings/input-settings-bus.schema.json"
    },
    "load": {
      "$ref": "./settings/input-settings-load.schema.json"
    },
    "shunt": {
      "$ref": "./settings/input-settings-shunt.schema.json"
    },
    "line": {
      "$ref": "./settings/input-settings-line.schema.json"
    },
    "switch": {
      "$ref": "./settings/input-settings-switch.schema.json"
    },
    "transformer": {
      "$ref": "./settings/input-settings-transformer.schema.json"
    },
    "max_switch_actions": {
      "type": ["array", "number"],
      "description": "The maximum allowed switching actions per timestep (or at each timestep, if an array)",
      "items": {
        "type": "number"
      }
    },
    "disable_networking": {
      "type": ["boolean"],
      "description": "Disables microgrid networking"
    },
    "disable_radial_constraint": {
      "type": ["boolean"],
      "description": "Disables radiality constraints"
    },
    "disable_isolation_constraint": {
      "type": ["boolean"],
      "description": "Disables block isolation constraint"
    },
    "disable_inverter_constraint": {
      "type": ["boolean"],
      "description": "Disables constraint that enforces only one grid-forming inverter per connected component (might cause issues with Cbc)"
    },
    "disable_switch_penalty": {
      "type": ["boolean"],
      "description": "apply penalty to switching in objective"
    },
    "apply_switch_scores": {
      "type": ["boolean"],
      "description": "apply weight to switches in objective"
    },
    "disable_presolver": {
      "type": ["boolean"],
      "description": "disables presolvers on included solvers that support it (Gurobi, KNITRO)",
      "default": false
    },
    "time_elapsed": {
      "type": ["array", "number"],
      "description": "The time elapsed, in hours for each timestep, or individually after each timestep if an array",
      "items": {
        "type": "number"
      }
    },
    "nlp_solver_tol": {
      "type": "number",
      "description": "The tolerance of the nlp solver"
    },
    "mip_solver_tol": {
      "type": "number",
      "description": "The tolerance of the mip solver"
    },
    "mip_solver_gap": {
      "type": "number",
      "exclusiveMinimum": 0,
      "default": 0.05,
      "format": "float",
      "description": "MIP Gap for MIP/MISOCP solvers"
    }
  }
}
